World,WLD,ICT goods imports (% total goods imports),TM.VAL.ICTG.ZS.UN,,,,15.3963562149808,14.5861526529692,14.3329584650296,14.1250820525644,14.2540435922237,13.5664691868358,13.4580633107124,12.6472292108723,11.4870707914582,12.5372194452092,12.6185316787266,11.2300308520858,11.2152832224994,11.3109608691877,11.5086323326038,12.6849082186066,12.9077313742214,12.9987907371347,
World,WLD,Fuel imports (% of merchandise imports),TM.VAL.FUEL.ZS.UN,8.96957667229767,7.04320514971654,7.85854712582282,10.8219707481905,10.3911901879775,10.0212640537376,10.7481823334401,11.7001219791328,13.8675766512628,14.9573945664205,14.3885605383273,17.6934525753983,14.7905309311095,15.5866045017514,17.9063585825577,18.5599218759404,17.8543173648155,16.5472281616774,12.0042725686217,9.94068912336139,11.5865751014049,12.9093635912302
World,WLD,Food imports (% of merchandise imports),TM.VAL.FOOD.ZS.UN,8.40688091410108,8.54231947214609,8.15484432977767,7.14469014918955,7.45769286413998,7.59170889616884,7.53773595079511,7.0259979551927,6.64181529056017,6.28629947263777,6.57653949319867,6.91414344948981,8.01195892884016,7.52165606024671,7.689051981767,7.66384823768653,7.9874854035951,8.11819752410219,8.55741252693683,8.78266301461964,8.67465541350679,8.18077080622688
World,WLD,Agricultural raw materials imports (% of merchandise imports),TM.VAL.AGRI.ZS.UN,2.67564905215542,2.41772338532588,2.29094333232536,2.25472386441049,2.15665226430706,2.08148805328022,1.99611265104222,1.9183061465467,1.75870255551558,1.69261314058382,1.61851798464241,1.49296798991083,1.45829025536571,1.6116536197623,1.70780433344961,1.53972480436501,1.533980220094,1.48418783449554,1.5471369639806,1.50292107404239,1.4877149113604,1.22404370544006
World,WLD,Import unit value index (2000 = 100),TM.UVI.MRCH.XD.WD,,,,100,98.2295729,97.01487947,99.03350622,105.0274019,112.1067007,118.6726737,124.1999844,136.8865583,124.4086518,135.2364177,151.1000286,153.0864371,150.3189577,147.7919971,135.0391876,129.6274801,136.1912067,143.3624075
World,WLD,"Tariff rate, most favored nation, weighted mean, primary products (%)",TM.TAX.TCOM.WM.FN.ZS,,,,,,,,,,,,,,,,,,,,,,
World,WLD,"Tariff rate, applied, weighted mean, primary products (%)",TM.TAX.TCOM.WM.AR.ZS,,,,,,,,,,,,,,,,,,,,,,
World,WLD,"Share of tariff lines with specific rates, primary products (%)",TM.TAX.TCOM.SR.ZS,,,,,,,,,,,,,,,,,,,,,,
World,WLD,"Tariff rate, most favored nation, simple mean, primary products (%)",TM.TAX.TCOM.SM.FN.ZS,,,,,,,,,,,,,,,,,,,,,,
World,WLD,"Tariff rate, applied, simple mean, primary products (%)",TM.TAX.TCOM.SM.AR.ZS,,,,,,,,,,,,,,,,,,,,,,
World,WLD,"Share of tariff lines with international peaks, primary products (%)",TM.TAX.TCOM.IP.ZS,,,,,,,,,,,,,,,,,,,,,,
World,WLD,"Bound rate, simple mean, primary products (%)",TM.TAX.TCOM.BR.ZS,,,,,,,,,,,,,,,,,,,,,,
World,WLD,"Binding coverage, primary products (%)",TM.TAX.TCOM.BC.ZS,,,,,,,,,,,,,,,,,,,,,,
World,WLD,"Tariff rate, most favored nation, weighted mean, all products (%)",TM.TAX.MRCH.WM.FN.ZS,6.42,6.03,6.54,5.84,6.17,5.74,5.55,4.96,4.7,4.34,4.5,4.53,4.32,4.3,4.56,3.93,4.06,4.11,4.3,4.1,4.17,
World,WLD,"Tariff rate, applied, weighted mean, all products (%)",TM.TAX.MRCH.WM.AR.ZS,5.42,5.22,5.21,4.96,5.38,4.56,4.57,3.72,3.5,3.16,3.38,3.31,3.2,3.3,3.53,2.89,3.04,2.87,3.06,2.98,2.59,
World,WLD,"Share of tariff lines with specific rates, all products (%)",TM.TAX.MRCH.SR.ZS,1.672417,0.9790074,8.254114,1.625701,0.6583247,0.6194206,0.4792833,0.5169191,0.3579383,0.4026769,0.4366128,0.3829769,0.38145,0.3519751,1.753371,0.3534194,1.885786,0.0929911,0.6575924,0.5353811,0.3552292,
World,WLD,"Tariff rate, most favored nation, simple mean, all products (%)",TM.TAX.MRCH.SM.FN.ZS,12.26,12.66,13.13,12.7,11.44,11.74,10.85,10.28,10.53,10.12,9.82,9.88,9.79,9.67,9.67,9.22,9.36,9.14,9.33,9.25,8.9,
World,WLD,"Tariff rate, applied, simple mean, all products (%)",TM.TAX.MRCH.SM.AR.ZS,10.31,10.18,10.77,10.76,10.05,9.77,9.06,8.46,8.09,7.85,7.49,7.54,7.28,7.48,7.31,6.89,6.78,6.15,6.17,6.38,5.17,
World,WLD,"Share of tariff lines with international peaks, all products (%)",TM.TAX.MRCH.IP.ZS,20.16922,19.05879,19.35946,21.9468,20.72962,19.83016,20.77323,18.23321,15.43066,15.08905,16.59257,18.07278,16.48886,15.75425,15.62757,12.02674,14.59169,13.71038,12.76093,12.94091,10.83129,
World,WLD,"Bound rate, simple mean, all products (%)",TM.TAX.MRCH.BR.ZS,29.8,29.58,34.94,34.55,33.83,35.02,35.27,30.83,31.02,35.17,32.85,32.33,31.16,34.44,33.75,32.79,33.13,30.19,30.68,31.12,35.5,
World,WLD,"Binding coverage, all products (%)",TM.TAX.MRCH.BC.ZS,68.2,72.87,75.05,73.76,71.63,71.09,71.72,76.8,76.21,78.51,78.04,77.36,76.78,77.31,77.48,80.23,78.31,82.23,80.45,80.65,22.78,
World,WLD,"Tariff rate, most favored nation, weighted mean, manufactured products (%)",TM.TAX.MANF.WM.FN.ZS,,,,,,,,,,,,,,,,,,,,,,
World,WLD,"Tariff rate, applied, weighted mean, manufactured products (%)",TM.TAX.MANF.WM.AR.ZS,,,,,,,,,,,,,,,,,,,,,,
World,WLD,"Share of tariff lines with specific rates, manufactured products (%)",TM.TAX.MANF.SR.ZS,,,,,,,,,,,,,,,,,,,,,,
World,WLD,"Tariff rate, most favored nation, simple mean, manufactured products (%)",TM.TAX.MANF.SM.FN.ZS,,,,,,,,,,,,,,,,,,,,,,
World,WLD,"Tariff rate, applied, simple mean, manufactured products (%)",TM.TAX.MANF.SM.AR.ZS,,,,,,,,,,,,,,,,,,,,,,
World,WLD,"Share of tariff lines with international peaks, manufactured products (%)",TM.TAX.MANF.IP.ZS,,,,,,,,,,,,,,,,,,,,,,
World,WLD,"Bound rate, simple mean, manufactured products (%)",TM.TAX.MANF.BR.ZS,,,,,,,,,,,,,,,,,,,,,,
World,WLD,Law mandates equal remuneration for females and males for work of equal value (1=yes; 0=no),SG.LAW.EQRM.WK,,,,,,,,,,,,,,,,,,,,,,
World,WLD,Law prohibits or invalidates child or early marriage (1=yes; 0=no),SG.LAW.CHMR,,,,,,,,,,,,,,,,,,,,,,
World,WLD,Nonpregnant and nonnursing women can do the same jobs as men (1=yes; 0=no),SG.JOB.NOPN.EQ,,,,,,,,,,,,,,,,,,,,,,
World,WLD,Proportion of seats held by women in national parliaments (%),SG.GEN.PARL.ZS,11.6916484492417,13.0672780221823,13.5183124588003,13.9051783621924,14.0863857077416,15.1640703673774,15.175738784714,15.8974391624222,16.4818221269902,16.9776763283719,17.8701828790621,18.445654385777,19.0284570038859,19.1596428571429,19.8291592503403,20.7571878712743,21.7657243355915,22.184438093726,22.8521658791542,23.0203347687891,23.6506251275771,23.9687042815489
World,WLD,"Women making their own informed decisions regarding sexual relations, contraceptive use and reproductive health care  (% of women age 15-49)",SG.DMK.SRCR.FN.ZS,,,,,,,,,,,,,,,,,,,,,,
World,WLD,"Women participating in the three decisions (own health care, major household purchases, and visiting family) (% of women age 15-49)",SG.DMK.ALLD.FN.ZS,,,,,,,,,,,,,,,,,,,,,,
World,WLD,"Government expenditure on education, total (% of GDP)",SE.XPD.TOTL.GD.ZS,,,,,,,,,,,,,,,,,,,,,,
World,WLD,"Government expenditure on education, total (% of government expenditure)",SE.XPD.TOTL.GB.ZS,,,,,,,,,,,,,,,,,,,,,,
World,WLD,Expenditure on tertiary education (% of government expenditure on education),SE.XPD.TERT.ZS,,,,,,,,,,,,,,,,,,,,,,
World,WLD,"Government expenditure per student, tertiary (% of GDP per capita)",SE.XPD.TERT.PC.ZS,,,,,,,,,,,,,,,,,,,,,,
World,WLD,Expenditure on secondary education (% of government expenditure on education),SE.XPD.SECO.ZS,,,,,,,,,,,,,,,,,,,,,,
World,WLD,"Government expenditure per student, secondary (% of GDP per capita)",SE.XPD.SECO.PC.ZS,,,,,,,,,,,,,,,,,,,,,,
World,WLD,Expenditure on primary education (% of government expenditure on education),SE.XPD.PRIM.ZS,,,,,,,,,,,,,,,,,,,,,,
World,WLD,"Government expenditure per student, primary (% of GDP per capita)",SE.XPD.PRIM.PC.ZS,,,,,,,,,,,,,,,,,,,,,,
World,WLD,"Current education expenditure, total (% of total expenditure in public institutions)",SE.XPD.CTOT.ZS,,,,,,,,,,,,,,,,,,,,,,
World,WLD,"Current education expenditure, tertiary (% of total expenditure in tertiary public institutions)",SE.XPD.CTER.ZS,,,,,,,,,,,,,,,,,,,,,,
World,WLD,"Current education expenditure, secondary (% of total expenditure in secondary public institutions)",SE.XPD.CSEC.ZS,,,,,,,,,,,,,,,,,,,,,,
World,WLD,"Current education expenditure, primary (% of total expenditure in primary public institutions)",SE.XPD.CPRM.ZS,,,,,,,,,,,,,,,,,,,,,,
World,WLD,"Tertiary education, academic staff (% female)",SE.TER.TCHR.FE.ZS,36.9643096923828,37.1894416809082,37.9891510009766,38.488468170166,38.8544006347656,39.2527694702148,39.0138816833496,39.4396705627441,40.0347290039063,40.4266014099121,40.7691497802734,41.2673797607422,41.7021598815918,41.78252,41.77715,41.73091,41.87768,42.07117,42.16424,42.19923,42.51534,42.94508
World,WLD,"School enrollment, tertiary, male (% gross)",SE.TER.ENRR.MA,16.7416801452637,17.5415000915527,18.4979095458984,19.12912940979,20.1544494628906,21.4188499450684,22.5430698394775,23.2511100769043,23.7646198272705,24.4118003845215,25.1771697998047,26.1056594848633,27.1236896514893,28.4959,30.27904,31.2664,31.7939,33.88621,34.82796,35.26675,35.59966,35.63923
World,WLD,"School enrollment, tertiary, female (% gross)",SE.TER.ENRR.FE,16.2018699645996,17.0839004516602,18.2839603424072,19.0276908874512,20.1122894287109,21.9423198699951,23.1629505157471,24.1317405700684,24.9430294036865,26.0055294036865,26.9372692108154,28.0610504150391,29.1950302124023,30.69155,32.57636,34.25506,35.18058,37.77819,38.89846,39.66109,40.27328,40.60496
World,WLD,"School enrollment, tertiary (% gross)",SE.TER.ENRR,16.4772701263428,17.3173694610596,18.3931198120117,19.0794696807861,20.133810043335,21.6749496459961,22.8462200164795,23.6818008422852,24.3405208587646,25.190559387207,26.0366802215576,27.0598297119141,28.1341400146484,29.56584,31.3979,32.71966,33.43855,35.77419,36.80101,37.39474,37.86174,38.04186
World,WLD,"Pupil-teacher ratio, tertiary",SE.TER.ENRL.TC.ZS,,,,,,,,,,,,,,,,,,,,,,
World,WLD,"Educational attainment, at least completed short-cycle tertiary, population 25+, total (%) (cumulative)",SE.TER.CUAT.ST.ZS,,,,,,,,,,,,,,,,,,,,,,
World,WLD,"Educational attainment, at least completed short-cycle tertiary, population 25+, male (%) (cumulative)",SE.TER.CUAT.ST.MA.ZS,,,,,,,,,,,,,,,,,,,,,,
World,WLD,"Educational attainment, at least completed short-cycle tertiary, population 25+, female (%) (cumulative)",SE.TER.CUAT.ST.FE.ZS,,,,,,,,,,,,,,,,,,,,,,
World,WLD,"Educational attainment, at least Master's or equivalent, population 25+, total (%) (cumulative)",SE.TER.CUAT.MS.ZS,,,,,,,,,,,,,,,,,,,,,,
World,WLD,"Educational attainment, at least Master's or equivalent, population 25+, male (%) (cumulative)",SE.TER.CUAT.MS.MA.ZS,,,,,,,,,,,,,,,,,,,,,,
World,WLD,"Educational attainment, at least Master's or equivalent, population 25+, female (%) (cumulative)",SE.TER.CUAT.MS.FE.ZS,,,,,,,,,,,,,,,,,,,,,,
World,WLD,"Educational attainment, Doctoral or equivalent, population 25+, total (%) (cumulative)",SE.TER.CUAT.DO.ZS,,,,,,,,,,,,,,,,,,,,,,
World,WLD,"Educational attainment, Doctoral or equivalent, population 25+, male (%) (cumulative)",SE.TER.CUAT.DO.MA.ZS,,,,,,,,,,,,,,,,,,,,,,
World,WLD,"Educational attainment, Doctoral or equivalent, population 25+, female (%) (cumulative)",SE.TER.CUAT.DO.FE.ZS,,,,,,,,,,,,,,,,,,,,,,
World,WLD,"Educational attainment, at least Bachelor's or equivalent, population 25+, total (%) (cumulative)",SE.TER.CUAT.BA.ZS,,,,,,,,,,,,,,,,,,,,,,
World,WLD,"Educational attainment, at least Bachelor's or equivalent, population 25+, male (%) (cumulative)",SE.TER.CUAT.BA.MA.ZS,,,,,,,,,,,,,,,,,,,,,,
World,WLD,"Educational attainment, at least Bachelor's or equivalent, population 25+, female (%) (cumulative)",SE.TER.CUAT.BA.FE.ZS,,,,,,,,,,,,,,,,,,,,,,
World,WLD,Adolescents out of school (% of lower secondary school age),SE.SEC.UNER.LO.ZS,,26.0463199615479,26.1339092254639,25.4016494750977,24.8824806213379,23.6409492492676,21.7507591247559,20.8682804107666,20.1717891693115,19.772970199585,18.9868392944336,18.6278495788574,18.2360801696777,17.54285,17.28884,16.82221,16.73903,16.79649,15.98394,15.73936,15.59048,15.55311
World,WLD,"Adolescents out of school, male (% of male lower secondary school age)",SE.SEC.UNER.LO.MA.ZS,,23.3899707794189,23.4539108276367,22.7853393554688,22.4824104309082,21.5878295898438,20.0643196105957,19.4119205474854,18.6515998840332,18.4287300109863,17.6526908874512,17.5560092926025,17.4090309143066,16.95736,16.88764,16.58535,16.71446,16.85429,15.89867,15.62377,15.44011,15.47836
World,WLD,"Adolescents out of school, female (% of female lower secondary school age)",SE.SEC.UNER.LO.FE.ZS,,28.8376502990723,28.9495697021484,28.1548404693604,27.4097995758057,25.8049201965332,23.5325298309326,22.4095306396484,21.7840309143066,21.2009201049805,20.4068794250488,19.7703609466553,19.1183490753174,18.16736,17.71698,17.0752,16.7653,16.73458,16.07518,15.86305,15.75136,15.63308
World,WLD,"Secondary education, teachers (% female)",SE.SEC.TCHR.FE.ZS,50.7403793334961,51.4193801879883,52.362548828125,51.6154098510742,51.9368515014648,52.0516090393066,52.2892990112305,52.2643203735352,52.322940826416,51.9383201599121,51.6134796142578,51.6080284118652,51.9445114135742,52.07518,52.39085,52.48819,53.19498,53.09579,53.20952,53.16884,53.75298,54.09473
World,WLD,"Secondary education, teachers, female",SE.SEC.TCHR.FE,12149924,12606304,13082068,13154412,13263623,13684080,14190226,14470540,14908967,15156877,15582917,16079630,16479180,16800000,17100000,17200000,17300000,17500000,17800000,18200000,18700000,18900000
World,WLD,"Secondary education, teachers",SE.SEC.TCHR,23945272,24516638,24983638,25485436,25537982,26289446,27137918,27687224,28494132,29182454,30191564,31157226,31724588,32300000,32600000,32800000,32500000,33000000,33500000,34300000,34700000,35000000
World,WLD,Trained teachers in secondary education (% of total teachers),SE.SEC.TCAQ.ZS,,,,,,,,,,,,,,,,,,,,,86.01745,
World,WLD,Trained teachers in upper secondary education (% of total teachers),SE.SEC.TCAQ.UP.ZS,,,,,,,,,,,,,,,,,,,,,,
World,WLD,"Trained teachers in upper secondary education, male (% of male teachers)",SE.SEC.TCAQ.UP.MA.ZS,,,,,,,,,,,,,,,,,,,,,,
World,WLD,"Trained teachers in upper secondary education, female (% of female teachers)",SE.SEC.TCAQ.UP.FE.ZS,,,,,,,,,,,,,,,,,,,,,,
World,WLD,"Trained teachers in secondary education, male (% of male teachers)",SE.SEC.TCAQ.MA.ZS,,,,,,,,,,,,,,,,,,,,,,
World,WLD,Trained teachers in lower secondary education (% of total teachers),SE.SEC.TCAQ.LO.ZS,,,,,,,,,,,,,,,,,,,,83.66555,,
World,WLD,"Trained teachers in lower secondary education, male (% of male teachers)",SE.SEC.TCAQ.LO.MA.ZS,,,,,,,,,,,,,,,,,,,,81.68944,,
World,WLD,"Trained teachers in lower secondary education, female (% of female teachers)",SE.SEC.TCAQ.LO.FE.ZS,,,,,,,,,,,,,,,,,,,,85.22321,,
World,WLD,"Trained teachers in secondary education, female (% of female teachers)",SE.SEC.TCAQ.FE.ZS,,,,,,,,,,,,,,,,,,,,,,
World,WLD,Progression to secondary school (%),SE.SEC.PROG.ZS,86.7515487670898,86.8813705444336,87.5394821166992,87.8648834228516,89.1595230102539,89.3827590942383,89.537353515625,89.586067199707,90.4270629882813,91.3540115356445,91.5389099121094,91.4965286254883,91.4373474121094,91.44477,91.68801,90.6942,90.50994,90.66304,91.1741,90.86857,91.3076,
World,WLD,"Progression to secondary school, male (%)",SE.SEC.PROG.MA.ZS,87.5040130615234,87.5615310668945,88.1567001342773,88.3242797851563,89.5983428955078,89.111686706543,90.0743408203125,90.1504364013672,90.8342590332031,91.7165679931641,91.6717071533203,91.6553573608398,,91.21799,91.72354,90.84775,90.62181,90.75678,91.30774,91.04049,91.46274,
World,WLD,"Progression to secondary school, female (%)",SE.SEC.PROG.FE.ZS,85.8517227172852,86.0713195800781,86.8077392578125,87.3122406005859,88.6273422241211,89.6554183959961,88.8923034667969,88.9020462036133,89.9154586791992,90.8793792724609,91.3157196044922,91.2471694946289,,91.62866,91.57362,90.44522,90.30597,90.4861,90.95731,90.60188,91.06873,
World,WLD,"School enrollment, secondary, private (% of total secondary)",SE.SEC.PRIV.ZS,,19.2109603881836,19.1299991607666,19.1744499206543,19.0082702636719,18.9409809112549,19.1966800689697,19.4197692871094,19.910120010376,20.1679706573486,21.0437602996826,21.4402103424072,21.969669342041,22.58867,23.21927,23.84868,24.22353,25.68907,25.94257,26.45672,26.37334,26.46609
World,WLD,"School enrollment, secondary, male (% net)",SE.SEC.NENR.MA,,56.1372108459473,56.2731895446777,57.0533103942871,57.3919296264648,57.6707496643066,58.2726707458496,58.9875106811523,59.4934387207031,60.0298690795898,60.9672584533691,61.6123809814453,61.8743515014648,62.96926,63.77674,63.75537,64.96435,65.63201,65.66595,65.81118,66.13172,66.2793
World,WLD,"School enrollment, secondary, female (% net)",SE.SEC.NENR.FE,,51.5402717590332,51.8327293395996,52.717529296875,53.609130859375,54.3699989318848,55.5553398132324,56.5770683288574,57.4469413757324,58.1520195007324,59.1570816040039,60.0248794555664,60.7105484008789,62.09554,63.27635,63.8382,64.8316,65.6666,65.76561,65.8486,66.26728,66.26578
World,WLD,"School enrollment, secondary (% net)",SE.SEC.NENR,,53.8954315185547,54.1065902709961,54.9395408630371,55.547191619873,56.0607681274414,56.9491806030273,57.8139114379883,58.4977493286133,59.1155281066895,60.0891494750977,60.8424110412598,61.309700012207,62.54485,63.53369,63.79482,64.8996,65.64805,65.71337,65.82859,66.19644,66.27183
World,WLD,"School enrollment, secondary, male (% gross)",SE.SEC.ENRR.MA,61.7313499450684,62.0207786560059,61.8088684082031,62.3769187927246,62.7360000610352,63.5166091918945,64.1058502197266,65.0569076538086,65.7810897827148,66.897331237793,68.3907318115234,69.835693359375,70.3290863037109,72.19815,73.32537,74.03789,75.0608,75.72876,75.86081,76.03956,75.82658,75.98374
World,WLD,"School enrollment, secondary, female (% gross)",SE.SEC.ENRR.FE,55.1276817321777,56.2264785766602,56.6646995544434,57.3569488525391,57.8331413269043,58.7612991333008,60.1736183166504,61.1679000854492,62.3131217956543,63.5747489929199,65.4191207885742,67.2312088012695,68.4076309204102,69.84055,71.11477,72.0403,73.89593,74.88155,74.94239,75.23622,74.89559,75.10783
World,WLD,"School enrollment, secondary (% gross)",SE.SEC.ENRR,58.5103912353516,59.1955909729004,59.3014183044434,59.9314804077148,60.3481292724609,61.201358795166,62.1931190490723,63.1664009094238,64.096549987793,65.2846527099609,66.9504013061523,68.5744705200195,69.3992309570313,71.05775,72.25662,73.0725,74.49809,75.31977,75.41746,75.65189,75.37733,75.56108
World,WLD,"Secondary education, vocational pupils (% female)",SE.SEC.ENRL.VO.FE.ZS,44.6713714599609,44.6935691833496,44.9141998291016,44.8810081481934,44.8093414306641,44.400951385498,44.4931182861328,44.4824981689453,45.1703796386719,45.3999099731445,45.4630584716797,45.4181594848633,45.3356018066406,43.61373,43.47067,43395,43.46294,43.41648,43.52328,43.36764,42.81232,42.47584
World,WLD,"Secondary education, vocational pupils",SE.SEC.ENRL.VO,47460664,47006684,46766420,45847220,46280252,45706144,45676532,49299460,50427732,51677392,53903168,56246168,57649996,59500000,60300000,60600000,65200000,63500000,61800000,61100000,62200000,62500000
World,WLD,"Pupil-teacher ratio, upper secondary",SE.SEC.ENRL.UP.TC.ZS,15.4454097747803,16.6164493560791,16.0691204071045,16.4278602600098,17.1753406524658,17.256519317627,16.8515491485596,17.0031509399414,16.8430995941162,16.7933197021484,16.2631092071533,16.0990600585938,16.0470104217529,15.98421,16.09995,16.27819,17.9494,17.93834,17.60635,17.33722,17.15356,17.15988
World,WLD,"Pupil-teacher ratio, secondary",SE.SEC.ENRL.TC.ZS,17.3492107391357,17.5251598358154,17.5426502227783,17.7491092681885,18.1802005767822,18.1739597320557,18.0907592773438,18.1242294311523,17.8721199035645,17.6670703887939,17.3490200042725,17.070930480957,16.885139465332,16.89097,17.02516,17.13973,17.68115,17.62001,17.41341,17.09064,16.94278,16.9982
World,WLD,"Pupil-teacher ratio, lower secondary",SE.SEC.ENRL.LO.TC.ZS,18.5885105133057,18.1073303222656,18.5596199035645,18.6490306854248,18.8327503204346,18.7638607025146,18.9378795623779,18.9083404541016,18.6062602996826,18.3071308135986,18.1795597076416,17.8381500244141,17.5500392913818,17.62234,17.79098,17.86417,17.47601,17.37316,17.26269,16.8994,16.78126,16.87411
World,WLD,"Secondary education, general pupils (% female)",SE.SEC.ENRL.GC.FE.ZS,46.1209602355957,46.5113410949707,46.7748794555664,46.8178215026855,46.8804397583008,46.9946708679199,47.3264808654785,47.355899810791,47.4482917785645,47.4734306335449,47.5788307189941,47.7196807861328,47.9874496459961,48.02286,48.08363,48.15862,48.48679,48.55483,48.49577,48.53036,48.55312,48.60941
World,WLD,"Secondary education, general pupils",SE.SEC.ENRL.GC,367970976,382651296,391512832,406496672,418005312,432077120,445268960,452510208,458822944,463891168,469890848,475636640,478024224,487000000,495000000,502000000,509000000,517000000,521000000,525000000,526000000,532000000
World,WLD,"Secondary education, pupils (% female)",SE.SEC.ENRL.FE.ZS,45.9553489685059,46.3124694824219,46.5763397216797,46.6215209960938,46.6739883422852,46.7465400695801,47.0628700256348,47.0736083984375,47.2227210998535,47.2655982971191,47.3610992431641,47.4762992858887,47.7020606994629,47.54244,47.58279,47.64525,47.91619,47.99342,47.96893,47.99251,47.94622,47.9647
World,WLD,"Secondary education, pupils",SE.SEC.ENRL,415431648,429657984,438279264,452343904,464285568,477783264,490945472,501809664,509250688,515568576,523794016,531882816,535674240,546000000,555000000,562000000,574000000,581000000,583000000,587000000,588000000,595000000
World,WLD,"Secondary education, duration (years)",SE.SEC.DURS,,,,,,,,,,,,,,,,,,,,,,
World,WLD,"Educational attainment, at least completed upper secondary, population 25+, total (%) (cumulative)",SE.SEC.CUAT.UP.ZS,,,,,,,,,,,,,,,,,,,,,,
World,WLD,"Educational attainment, at least completed upper secondary, population 25+, male (%) (cumulative)",SE.SEC.CUAT.UP.MA.ZS,,,,,,,,,,,,,,,,,,,,,,
World,WLD,"Educational attainment, at least completed upper secondary, population 25+, female (%) (cumulative)",SE.SEC.CUAT.UP.FE.ZS,,,,,,,,,,,,,,,,,,,,,,
World,WLD,"Educational attainment, at least completed post-secondary, population 25+, total (%) (cumulative)",SE.SEC.CUAT.PO.ZS,,,,,,,,,,,,,,,,,,,,,,
World,WLD,"Educational attainment, at least completed post-secondary, population 25+, male (%) (cumulative)",SE.SEC.CUAT.PO.MA.ZS,,,,,,,,,,,,,,,,,,,,,,
World,WLD,"Educational attainment, at least completed post-secondary, population 25+, female (%) (cumulative)",SE.SEC.CUAT.PO.FE.ZS,,,,,,,,,,,,,,,,,,,,,,
World,WLD,"Educational attainment, at least completed lower secondary, population 25+, total (%) (cumulative)",SE.SEC.CUAT.LO.ZS,,,,,,,,,,,,,,,,,,,,,,
World,WLD,"Educational attainment, at least completed lower secondary, population 25+, male (%) (cumulative)",SE.SEC.CUAT.LO.MA.ZS,,,,,,,,,,,,,,,,,,,,,,
World,WLD,"Educational attainment, at least completed lower secondary, population 25+, female (%) (cumulative)",SE.SEC.CUAT.LO.FE.ZS,,,,,,,,,,,,,,,,,,,,,,
World,WLD,"Lower secondary completion rate, total (% of relevant age group)",SE.SEC.CMPT.LO.ZS,60.3529090881348,61.2777404785156,62.2458190917969,63.4420585632324,64.7866897583008,66.6062469482422,68.3973083496094,69.3329391479492,69.8347473144531,70.306396484375,71.1239700317383,72.1393585205078,72.7987670898438,73.55142,74.46189,74.48197,74.2905,74.84375,75.7592,76.19845,75.57657,75.62763
World,WLD,"Lower secondary completion rate, male (% of relevant age group)",SE.SEC.CMPT.LO.MA.ZS,63.0588607788086,63.8248100280762,64.5977783203125,65.6133575439453,66.8102264404297,68.4482879638672,69.8488998413086,70.8034210205078,71.2232437133789,71.4929809570313,72.1376571655273,72.9902114868164,73.4225692749023,74.06407,74.90408,74.46085,73.9903,74.54086,75.3521,75.83413,75.16535,75.28588
World,WLD,"Lower secondary completion rate, female (% of relevant age group)",SE.SEC.CMPT.LO.FE.ZS,56.7674903869629,57.9041481018066,59.1371917724609,60.6066398620605,62.1844596862793,64.2488327026367,66.5003204345703,67.452262878418,68.0754318237305,68.7887725830078,69.8227920532227,71.0357818603516,71.9762191772461,72.87759,73.8961,74.43109,74.55047,75.10423,76.1258,76.51297,75.93494,75.99342
World,WLD,Lower secondary school starting age (years),SE.SEC.AGES,,,,,,,,,,,,,,,,,,,,,,
World,WLD,"Trademark applications, direct nonresident",IP.TMK.NRES,,,662131,834616,731783,656723,671200,740974,769428,816378,856683,839810,670806,774259,857432,880167,926350,920894,,,,
World,WLD,"Trademark applications, nonresident, by count",IP.TMK.NRCT,,,,,,,,956067,903402,1031106,1110076,1176938,891879,1100753,1236157,1344737,1542350,1514493,1585680,1695855,1780989,
World,WLD,"Patent applications, residents",IP.PAT.RESD,691667,706289,745200,824055,833279,826280,857224,896367,966272,998674,1055546,1081135,1076267,1161617,1292025,1441568,1625451,1713296,1864413,2128628,2161610,
World,WLD,"Patent applications, nonresidents",IP.PAT.NRES,384611,409205,426853,447515,495626,495023,494509,533020,592293,637188,669522,684324,633251,674241,713148,745329,773102,795600,820291,817323,821403,
World,WLD,Scientific and technical journal articles,IP.JRN.ARTC.SC,,,,,,,1185942.13113106,1305437.72440861,1477412.90760555,1563235.3152034,1655917.08084621,1747433.6658102,1859200.85375692,1954923.58941112,2063336.56736843,2129133.91584428,2210064.96203303,2299992.16390221,2306637.39674976,2296271.34647503,,
World,WLD,"Industrial design applications, resident, by count",IP.IDS.RSCT,,,233117,241693,255448,277820,281293,305124,373426,418338,482555,541215,608688,702836,812528,962517,986654,886253,848525,977270,960950,
World,WLD,"Industrial design applications, nonresident, by count",IP.IDS.NRCT,,,88926,106265,108611,113077,85358,88118,95875,101173,108902,119790,94449,108410,123556,134899,141394,139901,144201,148768,155625,
World,WLD,Public private partnerships investment in water and sanitation (current US$),IE.PPN.WATR.CD,,,,,,,,,,,,,,,,,,,,,,
World,WLD,Public private partnerships investment in transport (current US$),IE.PPN.TRAN.CD,,,,,,,,,,,,,,,,,,,,,,
